course_id,course_title,url,is_paid,price,num_subscribers,num_reviews,num_lectures,level,content_duration,published_timestamp,subject,profit,published_date,published_time,year,month,day,Clean_title
475914,Chugging - it don't mean a thing if it ain't got that swing!,https://www.udemy.com/getchugging/,True,200,382,21,25,All Levels,2.5 hours,2015-04-20T18:28:10Z,Musical Instruments,76400,2015-04-20,18:28:10Z,2015,4,20,chugging  mean thing aint got swing
364716,"Beginner Violin 101: Care, Maintenance, and the Right Gear",https://www.udemy.com/beginner-violin-101-care-maintenance-and-the-right-gear/,False,0,5543,107,29,All Levels,4 hours,2015-03-03T00:09:19Z,Musical Instruments,0,2015-03-03,00:09:19Z,2015,3,3,beginner violin 101 care maintenance right gear
64585,Gospel Piano Essentials,https://www.udemy.com/gospel-piano-essentials/,True,30,668,39,46,Intermediate Level,11.5 hours,2013-07-11T23:06:29Z,Musical Instruments,20040,2013-07-11,23:06:29Z,2013,7,11,gospel piano essentials
1009802,Play Piano 8 - Play Over the Rainbow by Ear & Free Improvise,https://www.udemy.com/play-piano-8-play-over-the-rainbow-by-ear-free-improvise/,True,50,1249,6,69,All Levels,1.5 hours,2016-11-14T19:17:21Z,Musical Instruments,62450,2016-11-14,19:17:21Z,2016,11,14,play piano 8  play rainbow ear  free improvise
206088,Guitar Chord Mastery!Turn Your Brain Into A Chord Encyclopia,https://www.udemy.com/total-fretboard-mastery/,True,200,4133,173,224,Intermediate Level,28.5 hours,2014-05-19T00:26:06Z,Musical Instruments,826600,2014-05-19,00:26:06Z,2014,5,19,guitar chord masteryturn brain chord encyclopia
823860,Trumpet Pro Series - You're going to love practicing Trumpet,https://www.udemy.com/trumpet-pro-series/,True,50,92,1,25,All Levels,6 hours,2016-04-22T23:43:37Z,Musical Instruments,4600,2016-04-22,23:43:37Z,2016,4,22,trumpet pro series  going love practicing trumpet
589248,Instant Harmonica - play Somewhere Over the Rainbow now!,https://www.udemy.com/instant-harmonica-play-somewhere-over-the-rainbow-now/,True,40,431,2,11,Beginner Level,1 hour,2016-01-04T21:22:38Z,Musical Instruments,17240,2016-01-04,21:22:38Z,2016,1,4,instant harmonica  play rainbow now
602812,"Music Theory, Guitar and Ear Training",https://www.udemy.com/holistic-guitar-ear-essentials/,True,60,30,3,39,Beginner Level,3 hours,2015-11-22T18:35:43Z,Musical Instruments,1800,2015-11-22,18:35:43Z,2015,11,22,music theory guitar ear training
935900,Pedais de efeito para Contrabaixo,https://www.udemy.com/pedais-de-efeito-para-contrabaixo/,True,50,10,3,10,All Levels,2.5 hours,2016-08-26T21:11:24Z,Musical Instruments,500,2016-08-26,21:11:24Z,2016,8,26,pedais de efeito para contrabaixo
744034,Piano With Willie: Jazz & Gospel Exercises,https://www.udemy.com/piano-with-willie-jazz-gospel-exercises/,True,40,56,3,28,Intermediate Level,2 hours,2016-04-13T06:57:11Z,Musical Instruments,2240,2016-04-13,06:57:11Z,2016,4,13,piano willie jazz  gospel exercises
814474,Oboe Pro Series - You're going to love practicing the Oboe,https://www.udemy.com/oboe-pro-series/,True,50,61,5,36,All Levels,7 hours,2016-04-08T23:26:22Z,Musical Instruments,3050,2016-04-08,23:26:22Z,2016,4,8,oboe pro series  going love practicing oboe
812370,Bassoon Pro Series - You're going to love practicing Bassoon,https://www.udemy.com/bassoon-pro-series/,True,50,36,0,42,All Levels,6.5 hours,2016-04-08T23:34:17Z,Musical Instruments,1800,2016-04-08,23:34:17Z,2016,4,8,bassoon pro series  going love practicing bassoon
813142,Horn Pro Series - You're going to love playing French Horn,https://www.udemy.com/horn-pro-series/,True,50,48,3,61,All Levels,8 hours,2016-04-08T23:08:08Z,Musical Instruments,2400,2016-04-08,23:08:08Z,2016,4,8,horn pro series  going love playing french horn
815182,Saxophone Pro Series - You're going to love practicing Sax,https://www.udemy.com/saxophone-pro-series/,True,50,119,4,32,All Levels,5.5 hours,2016-04-08T23:06:53Z,Musical Instruments,5950,2016-04-08,23:06:53Z,2016,4,8,saxophone pro series  going love practicing sax
902480,Pure Rock Guitar : Play Like the Gods of Rock!,https://www.udemy.com/pure-rock-guitar-play-like-the-gods-of-rock/,True,45,80,5,24,All Levels,4.5 hours,2016-07-29T21:24:14Z,Musical Instruments,3600,2016-07-29,21:24:14Z,2016,7,29,pure rock guitar  play like gods rock
767400,Sevillanas con Castañuelas - Baile y toque al mismo tiempo,https://www.udemy.com/sevillanas-con-castanuelas/,True,40,20,4,24,All Levels,1.5 hours,2016-02-23T18:24:02Z,Musical Instruments,800,2016-02-23,18:24:02Z,2016,2,23,sevillanas con castauelas  baile toque al mismo tiempo
854692,Instant Harmonica - play Over the Rainbow + Skye Boat now!,https://www.udemy.com/instant-harmonica-play-over-the-rainbow-skye-boat-now/,True,40,29,4,22,All Levels,1.5 hours,2016-07-18T21:54:18Z,Musical Instruments,1160,2016-07-18,21:54:18Z,2016,7,18,instant harmonica  play rainbow  skye boat now
245722,Painless Piano!,https://www.udemy.com/painless-piano/,True,40,353,1,30,Beginner Level,3.5 hours,2014-06-23T14:11:47Z,Musical Instruments,14120,2014-06-23,14:11:47Z,2014,6,23,painless piano
582390,Instant Harmonica - play When the Saints on harmonica now!,https://www.udemy.com/instant-harmonica-play-when-the-saints-on-harmonica-now/,True,20,31,1,10,Beginner Level,1 hour,2015-08-14T18:30:56Z,Musical Instruments,620,2015-08-14,18:30:56Z,2015,8,14,instant harmonica  play saints harmonica now
743846,Guitar Looper Basic Training,https://www.udemy.com/guitar-looper-basic-training/,True,45,64,13,15,All Levels,1.5 hours,2016-02-29T17:06:36Z,Musical Instruments,2880,2016-02-29,17:06:36Z,2016,2,29,guitar looper basic training
618396,Instant Harmonica - play the Drunken Sailor sea shanty now! ,https://www.udemy.com/instant-harmonica-play-the-drunken-sailor-sea-shanty-now/,True,20,27,3,9,Beginner Level,37 mins,2015-10-18T22:42:50Z,Musical Instruments,540,2015-10-18,22:42:50Z,2015,10,18,instant harmonica  play drunken sailor sea shanty now
566856,Learn Monster GODJ,https://www.udemy.com/learn-monster-godj/,False,0,991,29,12,Beginner Level,1 hour,2015-07-29T17:49:53Z,Musical Instruments,0,2015-07-29,17:49:53Z,2015,7,29,learn monster godj
854690,Instant Harmonica - play Summertime + Drunken Sailor now!,https://www.udemy.com/instant-harmonica-play-summertime-and-drunken-sailor-now/,True,40,26,2,20,All Levels,1.5 hours,2016-07-24T15:55:44Z,Musical Instruments,1040,2016-07-24,15:55:44Z,2016,7,24,instant harmonica  play summertime  drunken sailor now
933816,Instant Harmonica - play Yesterday + Scarborough Fair today!,https://www.udemy.com/instant-harmonica-play-yesterday-scarborough-fair-today/,True,40,33,5,26,All Levels,2 hours,2016-08-26T19:51:47Z,Musical Instruments,1320,2016-08-26,19:51:47Z,2016,8,26,instant harmonica  play yesterday  scarborough fair today
28295,Learn Web Designing & HTML5/CSS3 Essentials in 4-Hours,https://www.udemy.com/build-beautiful-html5-website/,True,75,43285,525,24,All Levels,4 hours,2013-01-03T00:55:31Z,Web Development,3246375,2013-01-03,00:55:31Z,2013,1,3,learn web designing  html5css3 essentials 4hours
19603,Learning Dynamic Website Design - PHP MySQL and JavaScript,https://www.udemy.com/learning-dynamic-website-design/,True,50,47886,285,125,All Levels,12.5 hours,2012-06-18T16:52:34Z,Web Development,2394300,2012-06-18,16:52:34Z,2012,6,18,learning dynamic website design  php mysql javascript
889438,ChatBots: Messenger ChatBot with API.AI and Node.JS,https://www.udemy.com/chatbots/,True,50,2577,529,64,All Levels,4.5 hours,2016-06-30T16:57:08Z,Web Development,128850,2016-06-30,16:57:08Z,2016,6,30,chatbots messenger chatbot apiai nodejs
197836,Projects in HTML5,https://www.udemy.com/projects-in-html5/,True,60,8777,206,75,Intermediate Level,15.5 hours,2014-06-17T05:43:50Z,Web Development,526620,2014-06-17,05:43:50Z,2014,6,17,projects html5
505208,Programming Foundations: HTML5 + CSS3 for Entrepreneurs 2015,https://www.udemy.com/html-css-more/,True,20,23764,490,58,Beginner Level,5.5 hours,2015-10-17T04:52:25Z,Web Development,475280,2015-10-17,04:52:25Z,2015,10,17,programming foundations html5  css3 entrepreneurs 2015
1094964,Build Your Own Backend REST API using Django REST Framework,https://www.udemy.com/django-python/,True,50,2669,112,72,Intermediate Level,5.5 hours,2017-04-27T19:21:11Z,Web Development,133450,2017-04-27,19:21:11Z,2017,4,27,build backend rest api django rest framework
965870,Angular and Firebase - Build a Web App with Typescript,https://www.udemy.com/angular-firebase-application/,True,150,1966,359,65,All Levels,5 hours,2016-09-27T21:46:03Z,Web Development,294900,2016-09-27,21:46:03Z,2016,9,27,angular firebase  build web app typescript
785388,Scaling Docker on AWS,https://www.udemy.com/scaling-docker-on-aws/,True,25,3133,351,63,All Levels,6 hours,2016-03-28T17:51:04Z,Web Development,78325,2016-03-28,17:51:04Z,2016,3,28,scaling docker aws
1146014,Learn JavaScript for beginners,https://www.udemy.com/learn-javascript-course/,True,200,15276,167,19,Beginner Level,1.5 hours,2017-03-16T20:57:12Z,Web Development,3055200,2017-03-16,20:57:12Z,2017,3,16,learn javascript beginners
8325,HTML Tutorial: HTML & CSS for Beginners,https://www.udemy.com/learn-html5/,True,20,12458,253,82,All Levels,4 hours,2011-09-09T15:28:59Z,Web Development,249160,2011-09-09,15:28:59Z,2011,9,9,html tutorial html  css beginners
987064,Learn by Doing: Vue JS 2.0 the Right Way,https://www.udemy.com/learn-by-doing-vue-js-2-the-right-way/,True,95,1087,220,32,Intermediate Level,3.5 hours,2016-11-07T17:53:40Z,Web Development,103265,2016-11-07,17:53:40Z,2016,11,7,learn doing vue js 20 right way
159070,Introduction to Web Development: HTML,https://www.udemy.com/webdevelopment101_html/,True,20,26800,333,55,Beginner Level,3 hours,2014-02-13T20:39:33Z,Web Development,536000,2014-02-13,20:39:33Z,2014,2,13,introduction web development html
16646,Web Programming with Python,https://www.udemy.com/web-programming-with-python/,True,50,35267,217,53,All Levels,4 hours,2012-04-25T00:01:43Z,Web Development,1763350,2012-04-25,00:01:43Z,2012,4,25,web programming python
678142,PHP Login and Registration System - Email Confirm Activation,https://www.udemy.com/php-mysql-login-and-registration-system-with-email-confirm-activation/,True,100,2607,317,49,All Levels,5 hours,2015-11-26T23:56:12Z,Web Development,260700,2015-11-26,23:56:12Z,2015,11,26,php login registration system  email confirm activation
948440,PSD to Responsive HTML5: Beginner to Advanced,https://www.udemy.com/psd-to-html5-beginner-to-advanced/,True,40,1502,218,49,All Levels,6 hours,2016-10-03T21:11:56Z,Web Development,60080,2016-10-03,21:11:56Z,2016,10,3,psd responsive html5 beginner advanced
1009452,Build Enterprise Applications with Angular 2 (and Angular 4),https://www.udemy.com/angular2-advanced/,True,190,6082,848,135,Intermediate Level,9.5 hours,2016-11-22T14:55:35Z,Web Development,1155580,2016-11-22,14:55:35Z,2016,11,22,build enterprise applications angular 2 and angular 4
1247828,Angular 4 (2+) Crash Course for Beginners,https://www.udemy.com/angular-crash-course-for-beginners/,True,120,12366,506,120,Beginner Level,9 hours,2017-06-23T00:35:49Z,Web Development,1483920,2017-06-23,00:35:49Z,2017,6,23,angular 4 2 crash course beginners
886300,Accelerated JavaScript Training,https://www.udemy.com/javascript-bootcamp-2016/,True,110,4720,1017,126,All Levels,7.5 hours,2016-07-12T18:23:35Z,Web Development,519200,2016-07-12,18:23:35Z,2016,7,12,accelerated javascript training
1009254,"Beginner API development in Node, Express, ES6, & MongoDB",https://www.udemy.com/api-development/,True,165,7057,655,65,Beginner Level,18.5 hours,2016-11-12T18:53:51Z,Web Development,1164405,2016-11-12,18:53:51Z,2016,11,12,beginner api development node express es6  mongodb
1078522,React JS and Redux - Mastering Web Apps,https://www.udemy.com/react-js-and-redux-mastering-web-apps/,True,60,16829,820,77,All Levels,5 hours,2017-01-19T04:58:10Z,Web Development,1009740,2017-01-19,04:58:10Z,2017,1,19,react js redux  mastering web apps
1002030,Web Development w/ Google’s Go (golang) Programming Language,https://www.udemy.com/go-programming-language/,True,65,4872,662,171,Intermediate Level,19 hours,2017-01-17T22:30:33Z,Web Development,316680,2017-01-17,22:30:33Z,2017,1,17,web development w googles golang programming language
1252318,The Complete HTML and CSS Course For Beginners,https://www.udemy.com/the-complete-html-and-css-course-for-beginners/,True,85,733,104,50,All Levels,3 hours,2017-06-20T16:05:46Z,Web Development,62305,2017-06-20,16:05:46Z,2017,6,20,complete html css course beginners
670034,Advanced Javascript,https://www.udemy.com/top-javascript-interview-questions-and-answers/,True,200,6601,1304,26,Intermediate Level,3.5 hours,2015-11-21T06:56:33Z,Web Development,1320200,2015-11-21,06:56:33Z,2015,11,21,advanced javascript
1052118,Dissecting Ruby on Rails 5 - Become a Professional Developer,https://www.udemy.com/professional-rails-5-development-course/,True,195,2804,418,212,All Levels,37.5 hours,2017-02-07T00:40:33Z,Web Development,546780,2017-02-07,00:40:33Z,2017,2,7,dissecting ruby rails 5  professional developer
669270,JQuery Essentials core training for Dynamic Interactive web,https://www.udemy.com/jquery-essentials-core-training-for-dynamic-interactive-web/,True,100,9668,38,52,All Levels,4 hours,2015-11-20T17:22:00Z,Web Development,966800,2015-11-20,17:22:00Z,2015,11,20,jquery essentials core training dynamic interactive web
1103954,Node.js: The Essentials + API Frameworks Express KOA Sails,https://www.udemy.com/nodejs-up-and-running/,True,20,2760,52,34,Beginner Level,1 hour,2017-02-16T21:59:01Z,Web Development,55200,2017-02-16,21:59:01Z,2017,2,16,nodejs essentials  api frameworks express koa sails
1017568,The Complete PHP Bootcamp Course With Video Sharing Project,https://www.udemy.com/php-bootcamp/,True,195,9831,56,74,Beginner Level,14.5 hours,2017-03-21T23:50:38Z,Web Development,1917045,2017-03-21,23:50:38Z,2017,3,21,complete php bootcamp course video sharing project
736940,Practical CSS Website Development: Crash Course ,https://www.udemy.com/css-website-development-crash-course/,True,95,11170,35,19,All Levels,2.5 hours,2016-02-02T21:05:27Z,Web Development,1061150,2016-02-02,21:05:27Z,2016,2,2,practical css website development crash course
1073793,Start Writing JavaScript Today - Beginner JavaScript Course,https://www.udemy.com/start-writing-javascript-today/,True,100,9067,41,27,Beginner Level,3 hours,2017-03-08T22:34:43Z,Web Development,906700,2017-03-08,22:34:43Z,2017,3,8,start writing javascript today  beginner javascript course
176432,HTML5 Essentials for Beginners,https://www.udemy.com/html5-essentials-for-beginners/,True,20,10247,200,15,Intermediate Level,1.5 hours,2014-03-14T21:46:36Z,Web Development,204940,2014-03-14,21:46:36Z,2014,3,14,html5 essentials beginners
73080,Step-by-step HTML and CSS for Absolute Beginners,https://www.udemy.com/step-by-step-html-and-css-for-absolute-beginners/,True,120,6162,324,43,Beginner Level,4 hours,2013-08-26T19:10:57Z,Web Development,739440,2013-08-26,19:10:57Z,2013,8,26,stepbystep html css absolute beginners
1256136,Angular 4 Development Decoded,https://www.udemy.com/marutiangular4/,True,20,1802,13,8,Intermediate Level,1 hour,2017-06-21T16:37:46Z,Web Development,36040,2017-06-21,16:37:46Z,2017,6,21,angular 4 development decoded
1124970,Javascript ES6! A Complete Reference Guide to Javascript ES6,https://www.udemy.com/javascript-es6-a-complete-reference-guide-to-javascript-es6/,True,175,4783,41,48,Intermediate Level,7 hours,2017-04-20T16:22:34Z,Web Development,837025,2017-04-20,16:22:34Z,2017,4,20,javascript es6 complete reference guide javascript es6
771198,Reactive JS:  Are you ready for the next big paradigm shift?,https://www.udemy.com/reactive-js-getting-ready-for-the-next-big-paradigm-shift/,True,60,2097,401,28,Intermediate Level,5.5 hours,2016-02-23T16:50:16Z,Web Development,125820,2016-02-23,16:50:16Z,2016,2,23,reactive js ready big paradigm shift
391546,Learn Python and Django: Payment Processing,https://www.udemy.com/learn-django-code-accept-payments-with-stripe/,True,70,17714,198,23,All Levels,3.5 hours,2015-02-09T15:37:56Z,Web Development,1239980,2015-02-09,15:37:56Z,2015,2,9,learn python django payment processing
629088,Code your first Website using HTML & CSS: Project Learning,https://www.udemy.com/code-your-first-website-using-html-css-project-learning/,True,20,9554,368,16,Beginner Level,1.5 hours,2015-10-28T18:16:52Z,Web Development,191080,2015-10-28,18:16:52Z,2015,10,28,code website html  css project learning
1006894,"React.js: Building Production Ready Apps, Start to Finish",https://www.udemy.com/reactjs-building-production-ready-apps-start-to-finish/,True,50,1129,137,77,All Levels,17.5 hours,2016-11-10T23:48:22Z,Web Development,56450,2016-11-10,23:48:22Z,2016,11,10,reactjs building production ready apps start finish
579338,Learn Object Oriented Programming PHP fundamentals bootcamp,https://www.udemy.com/learn-object-oriented-programming-php-fundamentals-bootcamp/,True,100,22213,142,16,All Levels,1 hour,2015-08-11T18:52:58Z,Web Development,2221300,2015-08-11,18:52:58Z,2015,8,11,learn object oriented programming php fundamentals bootcamp
945320,Javascript Intermediate level 2 - Mastering Functions,https://www.udemy.com/javascript-intermediate-mastering-functions/,True,100,2412,116,28,All Levels,2.5 hours,2016-08-30T18:20:56Z,Web Development,241200,2016-08-30,18:20:56Z,2016,8,30,javascript intermediate level 2  mastering functions
64605,1 Hour CSS,https://www.udemy.com/1-hour-css/,True,100,18324,333,16,Beginner Level,1 hour,2013-07-09T20:27:14Z,Web Development,1832400,2013-07-09,20:27:14Z,2013,7,9,1 hour css
897146,"Become a Full Stack Developer with Spring, AWS and Stripe",https://www.udemy.com/become-a-full-stack-developer-with-spring-aws-and-stripe/,True,75,1696,193,60,Intermediate Level,10 hours,2016-07-08T15:47:58Z,Web Development,127200,2016-07-08,15:47:58Z,2016,7,8,stack developer spring aws stripe
917724,Learn JavaScript for Web Development,https://www.udemy.com/javascript-learn-javascript-essentials-and-build-project/,True,75,12893,220,95,Intermediate Level,8.5 hours,2016-10-12T16:41:11Z,Web Development,966975,2016-10-12,16:41:11Z,2016,10,12,learn javascript web development
970874,"Complete AJAX Using Bootstrap, PHP From Basic To Advanced.",https://www.udemy.com/complete-ajax-using-bootstrap-php-from-basic-to-advanced/,True,195,4708,111,18,All Levels,2.5 hours,2016-10-06T04:49:57Z,Web Development,918060,2016-10-06,04:49:57Z,2016,10,6,complete ajax bootstrap php basic advanced
842058,Build A Web App With Spring Framework and Angular 2,https://www.udemy.com/build-a-web-app-with-spring-boot-and-angular-2/,True,145,1683,340,48,All Levels,8 hours,2016-05-08T18:47:05Z,Web Development,244035,2016-05-08,18:47:05Z,2016,5,8,build web app spring framework angular 2
937134,Javascript Intermediate level 3 - JSON,https://www.udemy.com/javascript-intermediate-json-course/,True,100,1735,76,25,All Levels,2.5 hours,2016-08-30T17:48:52Z,Web Development,173500,2016-08-30,17:48:52Z,2016,8,30,javascript intermediate level 3  json
752658,PHP: Ultimate guide to PHP for everyone,https://www.udemy.com/basic-php/,True,115,10103,75,20,Beginner Level,1.5 hours,2016-05-29T17:49:28Z,Web Development,1161845,2016-05-29,17:49:28Z,2016,5,29,php ultimate guide php
560990,JavaScript DOM Dynamic Web interactive content Boot Camp,https://www.udemy.com/javascript-dom-dynamic-web-interactive-content-boot-camp/,True,75,7380,43,59,All Levels,2.5 hours,2015-07-30T16:52:34Z,Web Development,553500,2015-07-30,16:52:34Z,2015,7,30,javascript dom dynamic web interactive content boot camp
1260288,"Master JavaScript Programming, 3 Projects Included !!",https://www.udemy.com/master-javascript-programming-extended-course/,True,20,3903,53,107,All Levels,10.5 hours,2017-06-27T23:16:24Z,Web Development,78060,2017-06-27,23:16:24Z,2017,6,27,master javascript programming 3 projects included 
918870,HTML CSS Learn to create a website from scratch,https://www.udemy.com/html-css-learn-to-create-a-website-from-scratch/,True,50,4892,49,32,Beginner Level,2 hours,2016-08-04T21:40:35Z,Web Development,244600,2016-08-04,21:40:35Z,2016,8,4,html css learn create website scratch
283014,HTML 5: How I made websites in HTML5,https://www.udemy.com/html5-certification/,True,135,15064,237,15,All Levels,1.5 hours,2014-10-23T19:43:16Z,Web Development,2033640,2014-10-23,19:43:16Z,2014,10,23,html 5 websites html5
787236,"Build Responsive Website Using HTML5, CSS3, JS And Bootstrap",https://www.udemy.com/build-responsive-website-using-html5-css3-js-and-bootstrap/,True,95,22623,783,73,All Levels,8 hours,2016-06-20T18:48:26Z,Web Development,2149185,2016-06-20,18:48:26Z,2016,6,20,build responsive website html5 css3 js bootstrap
1134390,Complete React JS web developer with ES6 - Build 10 projects,https://www.udemy.com/complete-react-js-course/,True,200,952,121,75,Beginner Level,12 hours,2017-03-22T20:09:26Z,Web Development,190400,2017-03-22,20:09:26Z,2017,3,22,complete react js web developer es6  build 10 projects
938560,The Complete Ethical Hacking Course 2.0: Python & Kali Linux,https://www.udemy.com/penetration-testing-ethical-hacking-course-python-kali-linux/,True,195,7827,268,66,All Levels,11 hours,2016-09-26T15:08:29Z,Web Development,1526265,2016-09-26,15:08:29Z,2016,9,26,complete ethical hacking course 20 python  kali linux
991290,Dynamic JavaScript Master Class AJAX JSON Simple APIs,https://www.udemy.com/ajax-course/,True,200,9773,117,65,Intermediate Level,4.5 hours,2016-10-24T15:36:40Z,Web Development,1954600,2016-10-24,15:36:40Z,2016,10,24,dynamic javascript master class ajax json simple apis
1165096,Vue JS - Mastering Web Apps,https://www.udemy.com/vue-web-apps/,True,80,13457,215,69,All Levels,4.5 hours,2017-04-06T16:57:56Z,Web Development,1076560,2017-04-06,16:57:56Z,2017,4,6,vue js  mastering web apps
1045942,Angular NgRx Store Masterclass - Covers Angular 4,https://www.udemy.com/angular-ngrx-course/,True,150,1399,212,89,Intermediate Level,8.5 hours,2017-01-19T00:35:43Z,Web Development,209850,2017-01-19,00:35:43Z,2017,1,19,angular ngrx store masterclass  covers angular 4
860812,JavaScript the Basics - JavaScript for Beginners,https://www.udemy.com/javascript-the-basics-for-beginners/,True,120,4028,674,93,Beginner Level,9 hours,2016-06-09T15:13:54Z,Web Development,483360,2016-06-09,15:13:54Z,2016,6,9,javascript basics  javascript beginners
1070976,"Complete E-Commerce Course - Java,Spring,Hibernate and MySQL",https://www.udemy.com/complete-e-commerce-course-javaspringhibernate-and-mysql/,True,195,1371,165,83,All Levels,20 hours,2017-01-16T23:50:02Z,Web Development,267345,2017-01-16,23:50:02Z,2017,1,16,complete ecommerce course  javaspringhibernate mysql
939962,"Learn SVG Animation - With HTML, CSS & Javascript",https://www.udemy.com/learn-svg-animation/,True,65,12953,680,22,All Levels,1.5 hours,2016-09-12T18:51:32Z,Web Development,841945,2016-09-12,18:51:32Z,2016,9,12,learn svg animation  html css  javascript
874960,"Build a Responsive Website with HTML5, CSS3 and Bootstrap 4",https://www.udemy.com/build-a-responsive-website-with-html5-css3-and-bootstrap-4/,True,20,5125,395,53,All Levels,7 hours,2016-08-09T17:53:33Z,Web Development,102500,2016-08-09,17:53:33Z,2016,8,9,build responsive website html5 css3 bootstrap 4
28295,Learn Web Designing & HTML5/CSS3 Essentials in 4-Hours,https://www.udemy.com/build-beautiful-html5-website/,True,75,43285,525,24,All Levels,4 hours,2013-01-03T00:55:31Z,Web Development,3246375,2013-01-03,00:55:31Z,2013,1,3,learn web designing  html5css3 essentials 4hours
24334,CSS Development (with CSS3!),https://www.udemy.com/css-development-with-css3/,True,20,25864,188,32,All Levels,5 hours,2012-10-31T16:39:49Z,Web Development,517280,2012-10-31,16:39:49Z,2012,10,31,css development with css3
997814,Angular 2 & TypeScript Beginner Web Development,https://www.udemy.com/angular2/,True,200,5211,414,133,Beginner Level,19.5 hours,2016-11-14T00:44:48Z,Web Development,1042200,2016-11-14,00:44:48Z,2016,11,14,angular 2  typescript beginner web development
641868,The Docker for DevOps course: From development to production,https://www.udemy.com/the-docker-for-devops-course-from-development-to-production/,True,25,8234,1111,110,All Levels,7.5 hours,2015-11-13T17:30:34Z,Web Development,205850,2015-11-13,17:30:34Z,2015,11,13,docker devops course development production
1042110,"Beginner Full Stack Web Development: HTML, CSS, React & Node",https://www.udemy.com/ultimate-web/,True,200,2687,331,138,Beginner Level,25.5 hours,2017-03-31T05:35:11Z,Web Development,537400,2017-03-31,05:35:11Z,2017,3,31,beginner stack web development html css react  node
883002,Learn Angular 2 Development By Building 12 Apps,https://www.udemy.com/learn-angular-2-development-by-building-10-apps/,True,50,5143,941,80,Intermediate Level,12 hours,2016-07-01T21:20:38Z,Web Development,257150,2016-07-01,21:20:38Z,2016,7,1,learn angular 2 development building 12 apps
1128050,"Server API Development in Swift, Kitura, & Bluemix",https://www.udemy.com/swift-kitura/,True,200,1827,129,66,Beginner Level,20.5 hours,2017-03-08T23:09:32Z,Web Development,365400,2017-03-08,23:09:32Z,2017,3,8,server api development swift kitura  bluemix
1218130,React VR - Creating Virtual Reality Apps,https://www.udemy.com/react-vr/,True,80,5026,72,43,All Levels,3 hours,2017-05-17T20:36:49Z,Web Development,402080,2017-05-17,20:36:49Z,2017,5,17,react vr  creating virtual reality apps
1123098,RxJs & Reactive Programming Angular Masterclass - Angular 4,https://www.udemy.com/rxjs-reactive-angular-course/,True,150,1301,179,80,All Levels,7.5 hours,2017-04-11T18:48:57Z,Web Development,195150,2017-04-11,18:48:57Z,2017,4,11,rxjs  reactive programming angular masterclass  angular 4
47963,"Coding for Entrepreneurs: Learn Python, Django, and More.",https://www.udemy.com/coding-for-entrepreneurs/,True,195,23412,799,251,All Levels,45 hours,2013-04-08T00:46:14Z,Web Development,4565340,2013-04-08,00:46:14Z,2013,4,8,coding entrepreneurs learn python django more
