course_id,course_title,url,is_paid,price,num_subscribers,num_reviews,num_lectures,level,content_duration,published_timestamp,subject,profit,published_date,published_time,year,month,day,Clean_title
782192,Introduction to HTML5 Canvas basics of drawing,https://www.udemy.com/introduction-to-html5-canvas-basics-of-drawing/,True,200,2918,16,17,Beginner Level,1 hour,2016-03-14T18:51:45Z,Web Development,583600,2016-03-14,18:51:45Z,2016,3,14,introduction html5 canvas basics drawing
978728,"Thoughtful Web Development Course: HTML, Vue.js, PHP, MySQL",https://www.udemy.com/web-development-html5-css3-php-oop-and-mysql-database/,True,200,842,144,536,All Levels,25 hours,2016-10-11T14:18:27Z,Web Development,168400,2016-10-11,14:18:27Z,2016,10,11,thoughtful web development course html vuejs php mysql
65493,Kids Coding - Beginners CSS,https://www.udemy.com/kids-coding-beginners-css/,True,100,7130,30,17,All Levels,1 hour,2013-07-25T19:55:43Z,Web Development,713000,2013-07-25,19:55:43Z,2013,7,25,kids coding  beginners css
32649,PHP & MySQL - Learn The Easy Way. Master PHP & MySQL Quickly,https://www.udemy.com/learning-php-and-mysql-development-the-easy-way/,True,50,5549,92,143,All Levels,15.5 hours,2012-12-15T15:22:52Z,Web Development,277450,2012-12-15,15:22:52Z,2012,12,15,php  mysql  learn easy way master php  mysql quickly
372518,Ruby On Rails For Web Development,https://www.udemy.com/ruby-on-rails-for-web-development/,True,195,2526,185,24,Beginner Level,5 hours,2014-12-17T19:01:59Z,Web Development,492570,2014-12-17,19:01:59Z,2014,12,17,ruby rails web development
99826,Become A Web Developer And Seller - Build Websites With HTML,https://www.udemy.com/the-ultimate-building-and-selling-websites-course/,True,200,21730,61,35,Beginner Level,2.5 hours,2013-10-05T12:49:46Z,Web Development,4346000,2013-10-05,12:49:46Z,2013,10,5,web developer seller  build websites html
1110756,HTML Tutorials : HTML Code for Website Creating,https://www.udemy.com/html-code-for-website/,True,20,2401,15,27,All Levels,3 hours,2017-02-22T17:36:27Z,Web Development,48020,2017-02-22,17:36:27Z,2017,2,22,html tutorials  html code website creating
595728,Complete HTML5 and CSS3 Course +1 Start to Finish Project,https://www.udemy.com/complete-html5-and-css3-course-1-start-to-finish-project/,True,200,3887,81,94,All Levels,8.5 hours,2015-09-07T23:42:50Z,Web Development,777400,2015-09-07,23:42:50Z,2015,9,7,complete html5 css3 course 1 start finish project
1231872,Web Development With HTML CSS BOOTSTRAP JQUERY for Beginners,https://www.udemy.com/web-development-with-html-css-bootstrap-jquery-for-beginners/,True,35,1156,4,59,Beginner Level,5 hours,2017-05-30T17:15:41Z,Web Development,40460,2017-05-30,17:15:41Z,2017,5,30,web development html css bootstrap jquery beginners
876850,HTML5 Specialist: Comprehensive HTML5 Training,https://www.udemy.com/html5-specialist/,True,100,1385,188,83,All Levels,5 hours,2016-06-22T16:54:51Z,Web Development,138500,2016-06-22,16:54:51Z,2016,6,22,html5 specialist comprehensive html5 training
113518,CSS and CSS3 For Absolute Beginners,https://www.udemy.com/css-and-css3-for-absolute-beginners/,True,75,10890,212,33,Beginner Level,5 hours,2013-11-01T17:12:45Z,Web Development,816750,2013-11-01,17:12:45Z,2013,11,1,css css3 absolute beginners
834924,How to create HTML Forms,https://www.udemy.com/how-to-create-html-forms/,True,30,3652,60,7,Beginner Level,40 mins,2016-04-29T04:48:25Z,Web Development,109560,2016-04-29,04:48:25Z,2016,4,29,create html forms
764042,ReactJS and Flux: Learn By Building 10 Projects,https://www.udemy.com/reactjs-and-flux-learn-by-building-10-projects/,True,60,1723,258,60,All Levels,11 hours,2016-02-18T18:18:12Z,Web Development,103380,2016-02-18,18:18:12Z,2016,2,18,reactjs flux learn building 10 projects
838418,PHP Date and Time Course by Edwin Diaz,https://www.udemy.com/crash-course-learn-to-create-date-and-time-in-php-easily/,True,40,1653,53,14,All Levels,1.5 hours,2016-05-03T21:00:53Z,Web Development,66120,2016-05-03,21:00:53Z,2016,5,3,php date time course edwin diaz
669536,Hit the ground running with AngularJS with Dion Yang,https://www.udemy.com/hit-the-ground-running-with-angularjs-with-dion-yang/,True,100,4563,49,13,All Levels,1.5 hours,2015-11-26T17:16:53Z,Web Development,456300,2015-11-26,17:16:53Z,2015,11,26,hit ground running angularjs dion yang
511378,Learn CSS Transition and Animation ,https://www.udemy.com/css-transition-and-animation/,True,100,3757,28,20,All Levels,1 hour,2015-05-27T17:51:19Z,Web Development,375700,2015-05-27,17:51:19Z,2015,5,27,learn css transition animation
553582,Learn JavaScript from scratch,https://www.udemy.com/learn-javascript-from-scratch/,True,20,4193,92,44,Beginner Level,2.5 hours,2015-07-30T19:00:52Z,Web Development,83860,2015-07-30,19:00:52Z,2015,7,30,learn javascript scratch
636418,Learn Ruby on Rails for Absolute Beginners,https://www.udemy.com/learn-ruby-on-rails-for-absolute-beginners/,True,195,2875,20,36,All Levels,4.5 hours,2015-10-14T17:51:26Z,Web Development,560625,2015-10-14,17:51:26Z,2015,10,14,learn ruby rails absolute beginners
986442,JavaScript Tutorial,https://www.udemy.com/lets-learn-javascript-by-coding/,True,180,613,93,37,All Levels,4.5 hours,2016-10-17T15:07:49Z,Web Development,110340,2016-10-17,15:07:49Z,2016,10,17,javascript tutorial
936182,Learn By Example: Angular JS,https://www.udemy.com/learn-by-example-angular-js/,True,50,1515,32,60,All Levels,7 hours,2016-08-22T19:36:10Z,Web Development,75750,2016-08-22,19:36:10Z,2016,8,22,learn example angular js
294794,Create An HTML5 Video Player From Scratch,https://www.udemy.com/html5-video-player/,False,0,32260,1005,12,Beginner Level,1.5 hours,2014-09-05T19:16:53Z,Web Development,0,2014-09-05,19:16:53Z,2014,9,5,create html5 video player scratch
65330,Web Development By Doing: HTML / CSS From Scratch,https://www.udemy.com/web-development-learn-by-doing-html5-css3-from-scratch-introductory/,False,0,72932,2575,21,Beginner Level,1 hour,2013-09-25T00:42:09Z,Web Development,0,2013-09-25,00:42:09Z,2013,9,25,web development doing html  css scratch
173548,Build Your First Website in 1 Week with HTML5 and CSS3,https://www.udemy.com/build-your-first-website-in-1-week/,False,0,120291,5924,30,Beginner Level,3 hours,2014-04-08T16:21:30Z,Web Development,0,2014-04-08,16:21:30Z,2014,4,8,build website 1 week html5 css3
738360,Better way towards CSS using Less and Sass,https://www.udemy.com/better-way-towards-css-using-less-and-sass/,True,20,2227,44,26,All Levels,1.5 hours,2016-02-16T08:11:49Z,Web Development,44540,2016-02-16,08:11:49Z,2016,2,16,better way css sass
650328,JavaScript Complete for beginners with real world Apps,https://www.udemy.com/javascript-complete-and-comprehensive/,True,120,2652,33,40,All Levels,3.5 hours,2016-02-02T21:35:54Z,Web Development,318240,2016-02-02,21:35:54Z,2016,2,2,javascript complete beginners real world apps
69414,Creating a Responsive HTML Email,https://www.udemy.com/creating-responsive-html-email/,True,20,2520,183,34,All Levels,1.5 hours,2013-08-12T13:09:39Z,Web Development,50400,2013-08-12,13:09:39Z,2013,8,12,creating responsive html email
500628,Angular 2 Demystified,https://www.udemy.com/introduction-to-angular2/,True,20,3150,69,49,All Levels,3.5 hours,2015-05-18T20:48:48Z,Web Development,63000,2015-05-18,20:48:48Z,2015,5,18,angular 2 demystified
384078,Learn HTML Fast and Easy!,https://www.udemy.com/learn-to-code-html/,True,20,4011,24,17,Beginner Level,1.5 hours,2015-08-03T22:01:42Z,Web Development,80220,2015-08-03,22:01:42Z,2015,8,3,learn html fast easy
657710,Ruby on Rails for Complete Beginners,https://www.udemy.com/ruby-on-rails-tutorial-for-complete-beginners/,True,35,4839,129,84,Beginner Level,4 hours,2015-11-02T23:07:56Z,Web Development,169365,2015-11-02,23:07:56Z,2015,11,2,ruby rails complete beginners
997750,ASP NET CORE - ANGULAR 2 E-Commerce App,https://www.udemy.com/build-a-full-e-commerce-app-in-aspnet-core-mvc-6/,True,200,897,129,171,All Levels,13 hours,2017-01-13T17:06:35Z,Web Development,179400,2017-01-13,17:06:35Z,2017,1,13,asp net core  angular 2 ecommerce app
316704,Introductory JavaScript Made Easy Training Tutorial,https://www.udemy.com/introductory-javascript-made-easy-training-tutorial/,True,20,9381,138,131,Beginner Level,11 hours,2014-10-15T15:23:00Z,Web Development,187620,2014-10-15,15:23:00Z,2014,10,15,introductory javascript easy training tutorial
106178,Become a Heroku Rails Ninja: Expert Level Deployment Tools,https://www.udemy.com/become-a-heroku-rails-ninja/,True,50,7090,52,30,Intermediate Level,8.5 hours,2014-02-15T16:03:28Z,Web Development,354500,2014-02-15,16:03:28Z,2014,2,15,heroku rails ninja expert level deployment tools
1062686,Complete RESPONSIVE Website Design with HTML5 & CSS3,https://www.udemy.com/website_design/,True,20,2204,6,97,Beginner Level,9 hours,2017-02-03T04:19:46Z,Web Development,44080,2017-02-03,04:19:46Z,2017,2,3,complete responsive website design html5  css3
476408,"Learn HTML, A practical guide from scratch to HTML 5",https://www.udemy.com/learn-html-a-practical-guide-from-scratch-to-html-5/,True,100,5715,52,31,All Levels,3 hours,2015-04-26T12:35:16Z,Web Development,571500,2015-04-26,12:35:16Z,2015,4,26,learn html practical guide scratch html 5
1124244,JavaScript Tutorial: Learn JavaScript Code for Beginners,https://www.udemy.com/javascript-tutorial-for-beginners/,True,20,2074,14,22,Beginner Level,1.5 hours,2017-03-08T00:24:44Z,Web Development,41480,2017-03-08,00:24:44Z,2017,3,8,javascript tutorial learn javascript code beginners
217010,Website Secrets: Get a Gorgeous Website on the Cheap,https://www.udemy.com/how-to-get-an-excellent-website-at-a-lower-cost/,True,50,12328,15,32,All Levels,2 hours,2014-07-04T08:17:41Z,Web Development,616400,2014-07-04,08:17:41Z,2014,7,4,website secrets gorgeous website cheap
527952,PHP for Beginners: How to Build an E-Commerce Store,https://www.udemy.com/php-for-beginners-how-to-build-an-ecommerce-store/,True,100,5117,463,138,All Levels,14.5 hours,2015-07-17T18:52:45Z,Web Development,511700,2015-07-17,18:52:45Z,2015,7,17,php beginners build ecommerce store
745306,"Build Realtime Apps | React Js, Golang & RethinkDB",https://www.udemy.com/realtime-apps-with-reactjs-golang-rethinkdb/,True,60,3854,482,48,All Levels,3 hours,2016-01-29T20:30:27Z,Web Development,231240,2016-01-29,20:30:27Z,2016,1,29,build realtime apps  react js golang  rethinkdb
941998,"Master Electron: Desktop Apps using HTML, JavaScript & CSS",https://www.udemy.com/master-electron/,True,165,1902,224,47,Intermediate Level,5.5 hours,2017-03-21T23:58:01Z,Web Development,313830,2017-03-21,23:58:01Z,2017,3,21,master electron desktop apps html javascript  css
1204208,Mastering Micro Services Using Java Spring Boot,https://www.udemy.com/mastering-micro-services-using-java-sprint-boot/,True,195,1649,34,25,All Levels,2 hours,2017-05-17T17:43:14Z,Web Development,321555,2017-05-17,17:43:14Z,2017,5,17,mastering micro services java spring boot
957422,How to Create A Website: An HTML Tutorial and CSS Tutorial,https://www.udemy.com/html-tutorial/,True,65,3012,260,330,All Levels,32.5 hours,2016-09-25T20:55:57Z,Web Development,195780,2016-09-25,20:55:57Z,2016,9,25,create website html tutorial css tutorial
621022,Projects in MongoDB - Learn MongoDB Building Projects,https://www.udemy.com/projects-in-mongodb/,True,50,4628,247,93,All Levels,12 hours,2015-09-28T20:22:39Z,Web Development,231400,2015-09-28,20:22:39Z,2015,9,28,projects mongodb  learn mongodb building projects
30318,Learning JavaScript Programming Tutorial. A Definitive Guide,https://www.udemy.com/programming-javascript/,True,50,17113,380,93,All Levels,9.5 hours,2012-11-26T13:51:56Z,Web Development,855650,2012-11-26,13:51:56Z,2012,11,26,learning javascript programming tutorial definitive guide
1270392,"The Complete JavaScript, HTML and CSS Tutorial For Beginners",https://www.udemy.com/the-complete-javascript-html-and-css-tutorial-for-beginners/,True,35,244,44,21,Beginner Level,3 hours,2017-06-29T16:13:18Z,Web Development,8540,2017-06-29,16:13:18Z,2017,6,29,complete javascript html css tutorial beginners
991094,"Build Modern Responsive Website With HTML5, CSS3 & Bootstrap",https://www.udemy.com/build-modern-responsive-website-with-html5-css3-bootstrap/,True,195,1472,210,110,All Levels,13 hours,2017-02-08T05:44:46Z,Web Development,287040,2017-02-08,05:44:46Z,2017,2,8,build modern responsive website html5 css3  bootstrap
695656,The Complete JavaScript Course For Web Development Beginners,https://www.udemy.com/javascriptcourse/,True,195,31499,450,46,All Levels,4 hours,2015-12-29T17:20:32Z,Web Development,6142305,2015-12-29,17:20:32Z,2015,12,29,complete javascript course web development beginners
1174446,Email Marketing: Send Unlimited Emails via Own Mail Server,https://www.udemy.com/email-marketing-send-unlimited-emails-via-own-mail-server/,True,35,3539,43,20,Beginner Level,1 hour,2017-04-19T00:28:15Z,Web Development,123865,2017-04-19,00:28:15Z,2017,4,19,email marketing send unlimited emails mail server
1267892,Getting started with JavaScript,https://www.udemy.com/javascript-code/,True,200,1415,17,23,Beginner Level,1.5 hours,2017-06-27T00:56:40Z,Web Development,283000,2017-06-27,00:56:40Z,2017,6,27,getting started javascript
445534,Learn AngularJS Step By Step,https://www.udemy.com/maruti-angularjs/,True,20,18777,1112,21,Intermediate Level,1.5 hours,2015-07-07T00:08:10Z,Web Development,375540,2015-07-07,00:08:10Z,2015,7,7,learn angularjs step step
987666,Learn React : The World's Most Lucrative JavaScript Library,https://www.udemy.com/learn-react-the-worlds-most-lucrative-javascript-library/,True,50,1591,99,74,Beginner Level,9.5 hours,2017-02-08T00:40:08Z,Web Development,79550,2017-02-08,00:40:08Z,2017,2,8,learn react  worlds lucrative javascript library
983534,Try AngularJS: Beginner's Guide to Front End Web Development,https://www.udemy.com/try-angularjs/,True,50,16926,126,33,Beginner Level,4.5 hours,2016-10-13T20:38:03Z,Web Development,846300,2016-10-13,20:38:03Z,2016,10,13,try angularjs beginners guide end web development
563248,JavaScript Step by Step how to apply it to your web pages,https://www.udemy.com/javascript-fundamentals-bootcamp-learn-how-to-use-javascript/,True,100,13406,78,44,All Levels,1.5 hours,2015-07-26T17:44:17Z,Web Development,1340600,2015-07-26,17:44:17Z,2015,7,26,javascript step step apply web pages
1140532,Explore JavaScript Beginners Guide to Coding JavaScript,https://www.udemy.com/javascript-beginners-course/,True,200,5739,26,29,Beginner Level,2.5 hours,2017-03-12T21:38:57Z,Web Development,1147800,2017-03-12,21:38:57Z,2017,3,12,explore javascript beginners guide coding javascript
701636,Learn Web Scraping with Node.js,https://www.udemy.com/web-scraping-nodejs/,True,75,16731,137,10,All Levels,1 hour,2015-12-29T21:59:27Z,Web Development,1254825,2015-12-29,21:59:27Z,2015,12,29,learn web scraping nodejs
41295,Learn HTML5 Programming From Scratch,https://www.udemy.com/learn-html5-programming-from-scratch/,False,0,268923,8629,45,All Levels,10.5 hours,2013-02-14T07:03:41Z,Web Development,0,2013-02-14,07:03:41Z,2013,2,14,learn html5 programming scratch
984072,"Build Modern Websites Quick With HTML,CSS and Bootstrap",https://www.udemy.com/build-modern-websites-quick-with-htmlcss-and-bootstrap/,True,20,912,17,48,Beginner Level,4.5 hours,2016-10-18T15:48:43Z,Web Development,18240,2016-10-18,15:48:43Z,2016,10,18,build modern websites quick htmlcss bootstrap
429364,Master the Basics of HTML5 & CSS3: Beginner Web Development,https://www.udemy.com/master-the-basics-of-html5-css3-beginner-web-development/,False,0,26541,750,38,Beginner Level,3 hours,2015-05-21T22:47:47Z,Web Development,0,2015-05-21,22:47:47Z,2015,5,21,master basics html5  css3 beginner web development
1016388,Projects In ReactJS - The Complete React Learning Course,https://www.udemy.com/projects-in-reactjs-the-complete-react-learning-course/,True,50,947,108,56,Intermediate Level,8 hours,2016-11-22T04:21:03Z,Web Development,47350,2016-11-22,04:21:03Z,2016,11,22,projects reactjs  complete react learning course
978852,Beginning Web development Learn the basics of HTML,https://www.udemy.com/learn-the-basics-of-html-in-less-than-a-week/,True,95,9832,71,59,Beginner Level,2 hours,2017-01-06T15:14:59Z,Web Development,934040,2017-01-06,15:14:59Z,2017,1,6,beginning web development learn basics html
1199780,Hosting your static website on Amazon AWS S3 service,https://www.udemy.com/hosting-a-static-website-on-amazon-aws-s3-service/,True,20,2853,47,16,Beginner Level,1.5 hours,2017-05-05T23:42:32Z,Web Development,57060,2017-05-05,23:42:32Z,2017,5,5,hosting static website amazon aws s3 service
648118,JavaScript Rockstar How to create Incredible Useful code,https://www.udemy.com/javascript-projects-from-scratch-step-by-step-guide-to-learn/,True,75,16590,51,27,All Levels,2.5 hours,2015-10-29T18:30:46Z,Web Development,1244250,2015-10-29,18:30:46Z,2015,10,29,javascript rockstar create incredible useful code
863812,Spring Core DevOps on AWS,https://www.udemy.com/spring-core-devops-on-aws/,True,100,1626,115,78,Intermediate Level,6.5 hours,2016-11-15T21:59:55Z,Web Development,162600,2016-11-15,21:59:55Z,2016,11,15,spring core devops aws
639848,PHP Graphic Techniques: CAPTCHA/ Create a verification code,https://www.udemy.com/php-graphic-techniques-captcha-watermark-crop-thumbnail/,True,20,8320,73,11,All Levels,43 mins,2015-10-14T18:16:51Z,Web Development,166400,2015-10-14,18:16:51Z,2015,10,14,php graphic techniques captcha create verification code
942366,Introductory To HTML and CSS,https://www.udemy.com/introductory-to-html-and-css/,True,50,4106,112,15,Beginner Level,1 hour,2016-08-27T21:35:25Z,Web Development,205300,2016-08-27,21:35:25Z,2016,8,27,introductory html css
1103448,Learn how to convert PSD to HTML and CSS responsive,https://www.udemy.com/learn-how-to-convert-psd-to-html-and-css-responsive/,True,30,5324,52,14,All Levels,2.5 hours,2017-02-10T16:51:09Z,Web Development,159720,2017-02-10,16:51:09Z,2017,2,10,learn convert psd html css responsive
945602,PHP User Login Registration Script With All Features,https://www.udemy.com/php-user-login-registration-system/,True,200,5603,46,47,All Levels,4 hours,2016-10-02T19:14:23Z,Web Development,1120600,2016-10-02,19:14:23Z,2016,10,2,php user login registration script features
980114,The Complete TypeScript Programming Guide for Web Developers,https://www.udemy.com/typescript-programming/,True,40,236,31,35,Intermediate Level,4 hours,2016-10-12T17:02:13Z,Web Development,9440,2016-10-12,17:02:13Z,2016,10,12,complete typescript programming guide web developers
17887,JavaScript with BackboneJS and Bootstrap CSS - Advanced,https://www.udemy.com/advanced-javascript-with-backbonejs-and-bootstrap-css/,True,25,1758,37,16,Intermediate Level,3.5 hours,2012-05-21T18:22:09Z,Web Development,43950,2012-05-21,18:22:09Z,2012,5,21,javascript backbonejs bootstrap css  advanced
465210,Ruby on Rails Tutorial: Learn 6 Ruby on Rails SEO Techniques,https://www.udemy.com/ruby-on-rails-seo/,True,200,1266,16,21,All Levels,2 hours,2015-05-15T22:10:31Z,Web Development,253200,2015-05-15,22:10:31Z,2015,5,15,ruby rails tutorial learn 6 ruby rails seo techniques
708558,Learn HTML Basics From Scratch,https://www.udemy.com/learn-html-from-scratch/,False,0,5004,52,21,All Levels,3 hours,2015-12-29T19:01:04Z,Web Development,0,2015-12-29,19:01:04Z,2015,12,29,learn html basics scratch
783686,Byte-Sized-Chunks: Dynamic Prototypes in Javascript,https://www.udemy.com/dynamic-prototypes-in-javascript/,True,20,880,6,24,All Levels,3 hours,2016-03-10T18:01:22Z,Web Development,17600,2016-03-10,18:01:22Z,2016,3,10,bytesizedchunks dynamic prototypes javascript
344224,Java Spring Security,https://www.udemy.com/how-to-use-spring-security-to-secure-your-java-applications/,True,40,527,63,11,Intermediate Level,2.5 hours,2014-11-15T13:54:07Z,Web Development,21080,2014-11-15,13:54:07Z,2014,11,15,java spring security
235104,Responsive Html5 Theme Development,https://www.udemy.com/responsive-html5-theme-development/,True,20,1517,4,12,All Levels,1 hour,2014-06-06T21:51:59Z,Web Development,30340,2014-06-06,21:51:59Z,2014,6,6,responsive html5 theme development
543346,ReactJS Course: Learn JavaScript Library Used by Facebook&IG,https://www.udemy.com/react-js/,True,50,1018,33,41,Intermediate Level,3 hours,2015-07-07T13:42:32Z,Web Development,50900,2015-07-07,13:42:32Z,2015,7,7,reactjs course learn javascript library facebookig
575644,Building a Ruby on Rails Application with Neo4j,https://www.udemy.com/building-a-ruby-on-rails-application-with-neo4j/,False,0,4830,38,7,Intermediate Level,32 mins,2015-08-18T19:23:56Z,Web Development,0,2015-08-18,19:23:56Z,2015,8,18,building ruby rails application neo4j
1071060,Django by Example,https://www.udemy.com/django-by-example/,True,125,170,21,78,Expert Level,9 hours,2017-01-13T02:50:03Z,Web Development,21250,2017-01-13,02:50:03Z,2017,1,13,django example
469678,Wordpress on AWS: The Easy way to AWS for Free Fast hosting ,https://www.udemy.com/wordpress-on-aws-the-easy-way-to-aws-for-free-fast-hosting-amazon/,True,40,245,23,36,All Levels,1 hour,2015-08-11T23:47:57Z,Web Development,9800,2015-08-11,23:47:57Z,2015,8,11,wordpress aws easy way aws free fast hosting
708514,Mastering TypeScript,https://www.udemy.com/mastering-typescript/,True,95,353,34,41,Expert Level,3 hours,2015-12-29T23:10:30Z,Web Development,33535,2015-12-29,23:10:30Z,2015,12,29,mastering typescript
601260,Mastering AngularJS UI Development,https://www.udemy.com/mastering-angularjs-ui-development/,True,95,464,26,22,Expert Level,1.5 hours,2015-09-03T18:55:11Z,Web Development,44080,2015-09-03,18:55:11Z,2015,9,3,mastering angularjs ui development
687642,Custom Theme Creation for WordPress using HTML5 and CSS3,https://www.udemy.com/custom-theme-creation-for-wordpress/,True,35,298,20,24,Beginner Level,1.5 hours,2015-12-06T17:34:38Z,Web Development,10430,2015-12-06,17:34:38Z,2015,12,6,custom theme creation wordpress html5 css3
654422,Create a PHP Contact Form in Bootstrap,https://www.udemy.com/bootstrap-php-contact-form/,True,20,2238,65,12,All Levels,1 hour,2015-12-27T17:20:38Z,Web Development,44760,2015-12-27,17:20:38Z,2015,12,27,create php contact form bootstrap
634754,HTML Made Simple For Beginners: Create a One Page Website,https://www.udemy.com/html-made-simple-create-your-own-webpage-step-by-step/,True,65,3380,50,16,Beginner Level,2 hours,2015-10-14T22:08:17Z,Web Development,219700,2015-10-14,22:08:17Z,2015,10,14,html simple beginners create page website
773824,"Learn By Example: The Foundations of HTML, CSS & Javascript",https://www.udemy.com/learn-by-example-html-css-javascript/,True,50,1724,72,94,All Levels,13 hours,2016-02-29T23:04:14Z,Web Development,86200,2016-02-29,23:04:14Z,2016,2,29,learn example foundations html css  javascript
846578,JavaScript manipulation of the DOM Document Object Model,https://www.udemy.com/javascript-manipulation-of-the-dom-document-object-model/,True,20,1618,46,20,Beginner Level,1.5 hours,2016-05-13T05:09:09Z,Web Development,32360,2016-05-13,05:09:09Z,2016,5,13,javascript manipulation dom document object model
975060,Learn React JS from scratch,https://www.udemy.com/learn-react-js-from-scratch/,True,115,1562,42,34,Beginner Level,4 hours,2016-10-10T16:01:44Z,Web Development,179630,2016-10-10,16:01:44Z,2016,10,10,learn react js scratch
472526,PHP for Beginners,https://www.udemy.com/learn-php-via-examples-and-mini-tasks/,True,40,2626,95,135,Beginner Level,6 hours,2015-07-01T18:55:13Z,Web Development,105040,2015-07-01,18:55:13Z,2015,7,1,php beginners
1182108,Symfony 3: Build a PHP Application with Symfony,https://www.udemy.com/learn-symfony/,True,20,466,11,25,All Levels,2 hours,2017-04-20T16:15:04Z,Web Development,9320,2017-04-20,16:15:04Z,2017,4,20,symfony 3 build php application symfony
1121696,Google Blogger : How to Create a Blog,https://www.udemy.com/google-blogger-how-to-create-a-blog/,True,20,1763,17,30,Beginner Level,2 hours,2017-02-24T17:28:52Z,Web Development,35260,2017-02-24,17:28:52Z,2017,2,24,google blogger  create blog
409618,"Build a Real Time web app in node.js , Angular.js, mongoDB",https://www.udemy.com/realtime-meanstack/,True,20,3299,166,34,All Levels,4 hours,2015-03-04T00:11:45Z,Web Development,65980,2015-03-04,00:11:45Z,2015,3,4,build real time web app nodejs  angularjs mongodb
1169848,"Build Your Own Calculator App with Javascript, HTML5 & CSS",https://www.udemy.com/create-a-calculator-web-app-with-javascript-html-css/,True,50,3688,49,11,All Levels,1 hour,2017-04-13T17:36:32Z,Web Development,184400,2017-04-13,17:36:32Z,2017,4,13,build calculator app javascript html5  css
696016,HTML CSS Easy steps to create a web template from scratch,https://www.udemy.com/html-css-easy-steps-to-create-a-web-template-from-scratch/,True,200,11574,78,15,Beginner Level,1 hour,2015-12-14T19:48:12Z,Web Development,2314800,2015-12-14,19:48:12Z,2015,12,14,html css easy steps create web template scratch
1017116,Get to know HTML Learn HTML Basics,https://www.udemy.com/html-online-course/,True,200,10674,102,26,Beginner Level,2 hours,2016-11-22T15:09:59Z,Web Development,2134800,2016-11-22,15:09:59Z,2016,11,22,know html learn html basics
1243474,Ultimate Css & JQuery Form Designing From Beginner to Expert,https://www.udemy.com/ultimate-css-web-form-designing-from-beginner-to-expert/,True,115,783,5,13,All Levels,1 hour,2017-06-09T00:12:57Z,Web Development,90045,2017-06-09,00:12:57Z,2017,6,9,ultimate css  jquery form designing beginner expert
732556,PHP: Complete Registration and Login with Email Verification,https://www.udemy.com/php-complete-registration-and-login-with-email-verification/,True,20,12781,145,22,All Levels,2.5 hours,2016-01-27T18:16:28Z,Web Development,255620,2016-01-27,18:16:28Z,2016,1,27,php complete registration login email verification
426196,JavaScript from Beginner to Expert,https://www.udemy.com/javascript-from-beginner-to-expert-bring-life-to-your-site/,True,125,5484,439,92,All Levels,12.5 hours,2015-05-18T21:54:08Z,Web Development,685500,2015-05-18,21:54:08Z,2015,5,18,javascript beginner expert
